{
  "$schema": "http://json-schema.org/draft-07/schema#",
  "title": "ProcessingContainer",
  "type": "object",
  "required": [
      "name",
      "inputs",
      "description",
      "outputs",
      "command",
      "env"
  ],
  "properties": {
    "name": {
      "type": "string"
      },
    "description": {
      "type": "string"
      },
    "command": {
      "type": "array",
      "items": {
          "type": "string"
      }
    },
    "inputs": {
      "type": "array",
      "items": { "$ref": "IOMount.schema.json" },
      "default": []
      },
    "outputs": {
      "type": "array",
      "items": { "$ref": "IOMount.schema.json" },
      "default": []
      },
    "env": {
      "type": "array",
      "items": { "$ref": "ContainerEnvVar.schema.json" },
      "default": []
      },
    "resources": { "$ref": "Resources.schema.json" }
    }
}